Category;ID;QDanish;QEnglish;QDutch;Points;ADanish;AEnglish;ADutch;Assessment
Sales management;31;"""En vigtig kunde ringer til en Key Account Manager og siger, at de ikke gider 
så mange møder længere. 
Drøft hvordan virksomheden bør reagere""";"""An important customer calls a Key Account Manager and says they don't bother 
so many meetings longer. 
Discuss how the company should respond""";Een belangrijke klant belt een Key Account Manager en zegt dat ze niet meer zoveel lange meetings willen. Bspreek hoe het bedrijf moet reageren;NVT;5 points;5 points;5 punten;Moderator
Sales management;32;"""Sælgerne får ikke registreret kundedialoger i 
CRM-systemet. Hvad skal salgschefen gøre?  """;"""The salespeople do not register customer dialogues in 
CRM system. What should the sales manager do?""";"""De verkopers registreren geen klantdialogen in 
CRM-systeem. Wat moet de salesmanager doen?""";NVT;10 points;10 points;10 punten;Moderator
Sales management;33;"""En virksomheds e-handel vokser. Det bekymrer 
sælgerne, som kan miste deres provision. Hvordan sikrer virksomheden, at sælgerne bakker op om webshoppen?""";"""A company's e-commerce is growing. This is worrying 
the sellers, who may lose their commission. How does the company ensure that the salespeople support the webshop?""";"""De e-commerce van een bedrijf groeit. Dit is zorgwekkend voor 
de verkopers, die hun commissie kunnen verliezen. Hoe zorgt het bedrijf ervoor dat de verkopers de webshop ondersteunen?""";NVT;5 points;5 points;5 punten;Moderator
Megatrends;34;"""Et salgsteam er nysgerrig 
på bæredygtighed, men 
ved ikke, hvordan de kan 
bruge det. Drøft ud fra egne erfaringer, 
hvilke muligheder og 
udfordringer I ser?""";"""A sales team is curious 
on sustainability, but 
don't know how they can 
use it. Discuss from your own experience, 
What options and 
challenges you see?""";"""Een verkoopteam is nieuwsgierig 
op het gebied van duurzaamheid, maar 
ze weten niet hoe ze dat kunnen 
Gebruik het. Bespreek vanuit eigen ervaring, 
Welke opties en 
Uitdagingen zie je?""";NVT;20 points;20 points;20 punten;Moderator
Megatrends;35;"""Flere sælgere oplever, at kunderne spørger om virksomheden arbejder med FN´s Verdensmål. 
Bør salgschefen gøre noget på kort eller langt sigt?""";"""Several salespeople experience that customers ask if the company works with the UN's Sustainable Development Goals. 
Should the sales manager do something in the short or long term?""";"""Verschillende verkopers ervaren dat klanten vragen of het bedrijf werkt met de Sustainable Development Goals van de VN. 
Moet de salesmanager iets doen op korte of lange termijn?""";NVT;20 points;20 points;20 punten;Moderator
Megatrends;36;"""En kunde spørger om, de må leje et af 
virksomhedens populære produkter. Hvad skal 
virksomheden overveje, 
hvis de går leasing- eller abonnementsvejen?""";"""A customer asks if they can rent one of 
the company's popular products. What should 
The company consider, 
If they go the leasing or subscription route?""";"""Een klant vraagt of hij een van de 
de populaire producten van het bedrijf kan huren in plaats van kopen. Wat zouden de overwegingen van het bedrijf moeten zijn? Gaan ze voor leasing of abonnement?""";NVT;10 points;10 points;10 punten;Moderator
Chance;37;"""Hvad har været den sjoveste oplevelse med en kunde i dit 
nuværende job?""";"""What has been the most fun experience with a customer in your 
current job?""";"""Wat was de leukste ervaring met een klant in uw 
huidige baan?""";NVT;5 points;5 points;5 punten;Moderator
Chance;38;"""Et salgsteam får ingen nyttig kundeinfo fra virksomhedens 
serviceteknikere. 
Drøft hvad salgschefen kan gøre? """;"""A sales team gets no useful customer info from the company's 
Technicians. 
Discuss what the sales manager can do?""";"""Een verkoopteam krijgt geen nuttige klantinformatie van de 
Technici. 
Bespreek wat de salesmanager kan doen?""";NVT;10 points;10 points;10 punten;Moderator
Chance;39;Hvad er det første, du tænker på, når du vågner? ;What's the first thing you think of when you wake up?;Wat is het eerste waar je aan denkt als je wakker wordt?;NVT;5 points;5 points;5 punten;Moderator